{
	"contract_version": 1,
	"status": "partial",
	"entries": [
		{
			"id": "01H7M4NSRBX8C3J2Y9K1V5WDEF",
			"type": "historical-pattern",
			"source": "operational",
			"confidence": 0.82,
			"trust": 0.74,
			"body": {
				"title": "Tenant-scoped query missing WHERE org_id"
			},
			"last_validated": "2026-04-21T00:00:00.000Z",
			"shadowed_by": null
		}
	],
	"slices": {
		"historical-pattern": { "status": "ok", "count": 1 },
		"ownership": {
			"status": "timeout",
			"count": 0,
			"message": "slice exceeded fair share budget"
		}
	},
	"errors": [
		{
			"type": "ownership",
			"code": "timeout",
			"message": "slice exceeded fair share budget"
		}
	]
}
